{
  "options": {
    "host": "test.ru",
    "name": "allnews",

    "section": {
      "pagePattern": "news/page/{0}.html",
      "firstPageUrl": "news",
      "linkSelector": ""
    },

    "pagination": {
      "totalNumberOfPagesSelector": "",
      "reversed": false,
      "enabled": true
    },

    "page": {
      "articleBodySelector": "",
      "ignoreSelectors": [],
      "ignoreTags": [],
      "preserveTags": [],
      "ignoreClasses": [],
      "preserveClasses": [],
      "ignoreAttributes": [],
      "preserveAttributes": []
    },

    "parsingStrategy": {
      "__not_done_yet__": true
    }
  },

  "stats": {
    "pagesCount": 0,
    "fileGeneratedDate": 0,
    "parsingDates": []
  },

  "pages": [
    {
      "num": 1,
      "articles": [
        {
          "hash": "articleHash1",
          "parsed": true
        }
      ],
      "parsingDates": [1552937372643, 1552937372642]
    }
  ],

  "parsingResults": {
    "tags": [
      {
        "name": "iframe",
        "count": 0,
        "articles": ["articleHash1", "articleHash2"]
      }
    ],
    "classes": [
      {
        "name": "test-class/h1",
        "count": 0,
        "articles": ["articleHash1", "articleHash2"]
      }
    ],
    "attributes": [
      {
        "name": "href/a",
        "count": 0,
        "articles": ["articleHash1", "articleHash2"]
      }
    ],
    "unsupported": [
      {
        "name": "aside/aside",
        "count": 0,
        "articles": ["articleHash1", "articleHash2"]
      }
    ]
  },

  "articles": [
    {
      "hash": "lGm8M6aggLbMjIHt",
      "url": "/news/test/123456789.html",
      "fromPage": 15,
      "code": 200,
      "parsingDates": [1552937372643, 1552937372642]
    }
  ]
}
